{
  "$schema": "export_preset_v1",
  "id": "A2_Cyberpunk_v1",
  "version": 1,
  "display_name": "A2 Cyberpunk",
  "description": "Dystopian neon green and pink on black. High-tech urban aesthetic.",

  "bbox_preset": "stockholm_wide",
  "theme": "cyberpunk",

  "paper": {
    "format": "A2",
    "orientation": "landscape",
    "width_mm": 594,
    "height_mm": 420
  },

  "render": {
    "dpi": 150,
    "format": "png",
    "render_mode": "print"
  },

  "layers": {
    "hillshade": true,
    "water": true,
    "parks": false,
    "roads": true,
    "buildings": true,
    "contours": true
  },

  "composition": {
    "title": null,
    "subtitle": null,
    "show_attribution": true,
    "show_scale_bar": false
  },

  "constraints": {
    "dpi_locked": false,
    "dpi_min": 72,
    "dpi_max": 300,
    "format_locked": false,
    "allowed_formats": ["png", "pdf"],
    "layers_locked": false,
    "bbox_locked": false,
    "theme_locked": true
  },

  "meta": {
    "created": "2025-12-27",
    "author": "system",
    "use_case": "poster",
    "tags": ["print", "cyberpunk", "neon", "dark", "futuristic", "a2", "poster"]
  }
}
