{
  "$schema": "export_preset_v1",
  "id": "A4_High_Contrast_v1",
  "version": 1,
  "display_name": "A4 High Contrast",
  "description": "Maximum contrast black and white. Accessibility-focused design with thick lines.",

  "bbox_preset": "stockholm_core",
  "theme": "high-contrast",

  "paper": {
    "format": "A4",
    "orientation": "portrait",
    "width_mm": 210,
    "height_mm": 297
  },

  "render": {
    "dpi": 150,
    "format": "png",
    "render_mode": "print"
  },

  "layers": {
    "hillshade": true,
    "water": true,
    "parks": false,
    "roads": true,
    "buildings": true,
    "contours": true
  },

  "composition": {
    "title": null,
    "subtitle": null,
    "show_attribution": true,
    "show_scale_bar": true
  },

  "constraints": {
    "dpi_locked": false,
    "dpi_min": 72,
    "dpi_max": 300,
    "format_locked": false,
    "allowed_formats": ["png", "pdf"],
    "layers_locked": false,
    "bbox_locked": false,
    "theme_locked": true
  },

  "meta": {
    "created": "2025-12-27",
    "author": "system",
    "use_case": "accessible",
    "tags": ["print", "high-contrast", "accessible", "black-white", "a4"]
  }
}
